"My Fellow Belizeans,"
"I make one final point: Cabinet is, without exception, aware of and grateful for the thousands of exemplary public officers whose competence and initiative represent the highest ideal of service. These men and women of integrity and grit plow at all levels, in all Ministries, in Government and quasi-government departments and institutions."
"I offer them our respect and gratitude, and most importantly, an assurance that we will continue to manage the public finances in a manner that makes the stability and sustainability of your job our foremost objective."

Structural and Technical Reform
"Madam Speaker,"
"This Government is transforming the way it does the people’s business. Never before, in such a short period of time, have structural reforms been embraced with such enthusiasm and efficiency. And much of the focus is on the critical functions and processes of public finance management."
"First is the introduction of active cash/money management of government’s finances to minimize interest expenses and finance charges.  Recall that when we took office, the Government was borrowing almost $1 million per day.  This led to habitual almost addictive recourse to issuance of treasury securities and a ballooning of Government’s overdraft with the Central Bank of over $90 million.  In less than one year, this overdraft balance has been entirely eliminated under my administration without increasing the issue of domestic debt securities."
"Second is the introduction of market-based yield curve management of government-issued securities.  In the history of Belize, successive governments arbitrarily determined interest rates on treasury securities to its detriment.  The effect was that the government paid tens of millions more in interest expense than it should have paid.  It also meant that by such above-market yields on its benchmark government securities, government was contributing to higher interest rates in the financial system.  My administration is bringing that to an end in a phased manner through market-based yield curve management effective January 1, 2022.  This is already materially reducing the interest expense of government that will yield millions in savings but will also create a downward pressure on interest rates in the financial system."
"Third, is the comprehensive Public Finance Management Reform Program evidenced and supported by the recent Loan Motion authorized by the National Assembly for Government to access funding from the IDB in the sum of US$8.0 million."
This funding will support a Program consisting of four sub-component objectives which aim at strengthening public financial management: (i) improve the efficiency of key expenditure functions; (ii) promote economies of scale and competitiveness among suppliers in the procurement of all goods and services; (iii) promote a more sustainable technological infrastructure enabling processes to be more reliable and faster; (iv) improve institutional capacity for personnel to carry out processes and operate systems efficiently.
"Work in these areas has already commenced.  A draft centralized public procurement Bill is in its final stages, with assistance from the IDB, while an Internal Audit Bill is being finalized as well.  The former Bill will make provisions with respect to public procurement and for the retention and disposal of public property in accordance with the principles of good governance, accountability, transparency, integrity, fair competition, and value for money. It will largely align with the CARICOM model procurement law but go further. It will establish a Central Procurement Unit, a Procurement Board, and a Procurement Review Commission."
"Fourth is the Public Financial Management Support Programme, funded by the EU under the 11th EDF, which provides long term technical assistance in achieving a Public Finance Management Reform Action Plan with clear objectives linked to improving the PFM legal framework, specifically in internal and external audit and the Contractor General, as well as strengthening PFM oversight and control functions.  Under this Programme, the capacity of the Auditor General’s Department and the Contractor General’s Office has been strengthened with improved working procedures, strategic planning and capacity building actions through extensive guidance, collaboration, training and development of relevant documentation; an Internal Audit Unit in the Ministry of Finance was created and the legal framework to support the work of the new unit is being developed; a large number of public officers are to be trained in the areas of audit, financial procedures, training techniques, among others; and new computer equipment was handed over to these departments, including the Accountant General’s Department, to better equip these key departments to effectively carry out their mandates."
Fifth is the pursuit of a Fiscal Balance Sheet approach to public sector finance.
"The Government, in a phased manner and over the medium term, aims to develop full and comprehensive fiscal financial statements including a Fiscal balance sheet and a government asset inventory."
This will be done through the implementation of Accrual Basis accounting in accordance with INTERNATIONAL PUBLIC SECTOR ACCOUNTING STANDARDS (IPSAS).
"The aim is for Belize to have a comprehensive Balance Sheet that both captures the government asset inventory of financial and non-financial assets and shows the financial net worth of the country, a Statement of Cashflows that shows the cash receipts and payments for Government’s operations, investing activities and financing activities and an Income Statement that shows the annual performance of revenues and expenses for the year."
"Over time Belize will be on a path to ensure sustainability in the face of challenges like climate change, pandemics, geopolitical shocks. Belize will be able to responsibly create and manage fiscal space required to implement Plan Belize and the reforms required to improve the quality of life for all Belizeans. Most of all this will be done in a transparent and accountable way that is likely to prevent any future undermining of value that Belize has suffered due to fiscal imprudence and will create the atmosphere of confidence required to encourage investment and attract resources on better terms."
"In this regard, Madam Speaker, Belize has approached our IFI partners for Technical Assistance and the response has been positive. We expect to commence work on this program in the upcoming fiscal year."
"Madam Speaker, we intend to table this proposed legislation in this upcoming fiscal year for House consideration and approval as we strive to modernize our public financial management systems and bring greater efficiency and accountability in the management of our public finances."
"These structural reforms are not exhaustive by any means: two other examples stand out. First, the work of the Wages Council, from which I expect the minimum wage adjustment to be implemented during this fiscal year. And second, the People’s Constitutional Commission whose core task will be to propose ways of enhancing our democratic processes and deepening citizen participation in the governance of our communities."
Extraordinary Financing
"Madam Speaker,"
"I am pleased to confirm that Belize is one of only two countries chosen by the Millennium Challenge Corporation (MCC), an independent United States Government foreign aid agency, to give support to micro, small, and medium enterprises in its effort to reduce poverty through growth. The compact and threshold programs, which will be signed between the Government of Belize and MCC could result in Belize gaining between $300 million and $1 billion in grant funding to aid in the nation’s economic development."
"Belize was chosen by the MCC Board having satisfied themselves that the current administration is committed to governing justly, investing in the development of our people and its economic policy."
The MCC-funded projects are expected to commence in 2023 and last for a period of five years. MCC awards countries based on the principle that aid is most effective when it is reinforced by good governance.
"Madam Speaker, my Government is actively pursuing this initiative and has established a small dedicated unit in the Office of the Prime Minister to implement this program."
"I wish to take this opportunity to publicly acknowledge and thank the Government and people of the United States of America for this support and for this apparent vote of confidence in my Government and by extension, the people of Belize."
"In addition to the MCC Coordination Unit, we have set up the first-ever Climate Finance Unit in the Ministry of Economic Development to actively pursue grant funding from the specialized climate funds, primarily the Green Climate Fund (GCF)."
"The Unit has hit the ground running and in the space of less than one year, has been successful in obtaining pre-accreditation support from the GCF to facilitate both the Belize Social Investment Fund and the Ministry of Economic Development itself to become fully accredited members of the Fund and in doing so bridge the gap in services provided by national accredited entities.  It has also been successful in reviving tens of millions of dollars in concessionary and grant funding from IFAD and GCF under the Resilient Rural Belize Program for climate-smart agriculture and rural infrastructure, funds that were almost entirely lost due to lax behaviour and avoidable delays in implementation by the past UDP administration."
Government is also engaged with the GCF to facilitate the direct access of the private sector through collaboration with the Caribbean Development Bank as the Delivery Partner and Belize’s Chamber of Commerce and Industry as the lead Executing Entity. And efforts are underway to provide technical support to strengthen the operational policies of the Development Finance Corporation to enable it to comply with GCF accreditation requirements and therefore gain direct access to GCF financing.
"And finally, the Office of the Prime Minister has also activated a special desk to coordinate our commitments and capitalize on opportunities related to the Financing for Marine Conservation Program, the Blue Bonds. $168 million over 20 years will flow to the Conservation Trust under this agreement, at least 40 percent of which can be directed at financing public sector marine conservation. This Special Desk will also serve as the focal point for our exciting, high-potential new collaboration with the World Wildlife Fund called the Project Finance Permanence."
"With a high degree of confidence, I predict that Belize will benefit from massive new grant flows when all these various programs get into gear."

ACCELERATED FUNDING FROM THE REPUBLIC OF CHINA ON TAIWAN
"Madam Speaker,"
"I am pleased to inform this House and the Belizean people that our Mission to Taiwan last week secured extraordinary gains for this Budget and for the economy. Last year, as you will recall, Belize and Taiwan agreed to a 5-year program of grant and concessionary loan funding that totaled US 105m.  So far, and including this Budget for Fiscal Year 2022/23, Government will have drawn down US$15m in grants and US$42m in soft loans. Taiwan has now agreed that in this Fiscal Year, Belize can proceed to apply for the entire remainder USD 48m under this Agreement, in effect, converting a 5-year program to a 2-year program. In principle, the focal areas for investing these additional funds will be in education   expanding the Healthy Start Feeding Program and eventually, the Digital Devices Program; in Housing   expanding our current target for distributing quality, low cost housing units countrywide; and in financing SME credit, especially low interest loans in the Agro-productive sector."
"In the coming months, I will table a supplementary appropriations bill that will confirm each Program along with its funding amounts, for consideration and approval."
"And there is more exceptional news: I am elated to formally announce a USD 16.8m grant from Taiwan for the design and construction of a new hospital for Ambergris Caye, that hospital to commence construction in this fiscal year. The new hospital will be a 45-bed, 28,000 square feet state of the art facility providing primary and secondary care services. Others before us made hollow promises to build this much-needed facility.  It is this PUP Government that will finally deliver for the people of Ambergris Caye and of Belize Rural South."
Medium-Term Budget Forecast
"Madam Speaker,"
"Our Finance Team has included in the Budget a medium-term, 4-year forecast, with targets through to Fiscal Year 26/27."
"We envision revenues growing in the early years by 3 to 4 percent and levelling off at 2 percent growth in the outer years of the forecast period. Our goal is to hold firm on spending limits, at least for the short term, with expenditures rising by 2 to 3 percent starting in FY 25/26."
"To stabilize the public finances, a primary surplus of at least 2 percent of GDP is the bare minimum necessary. This is the goal identified in these projections, mainly because of restoring wages and withholding new revenue adjustments."
"Overall net financing for the 5-year period, including the new Budget, will be some $243 million; that is, the difference between required Budget financing and amortization payments. On the basis that GDP growth will exceed this new debt, the country’s debt to GDP will fall over the medium term."
I would also emphasize that Government expects capital investments   the combination of Capital II and III financing   to total $1.42 billion over this 5-year period.
Conclusion
"Madam Speaker,"
"The journey of sound public finance management is a constant, never-ending endeavor."
"No matter how much progress is made in one budget period, risks arise in another that can quickly undo that progress."
"In just the last few weeks, war has erupted in Eastern Europe. The unimaginable specter of oil at over US$200 per barrel presents a real and present danger to the Belizean economy and public finances."
"At US$200 per barrel, the cost of fuel imports could more than double to over Belize $30 million dollars per month, representing a massive drain on foreign exchange and, at some point, a substantial loss of revenue."
"Rising oil prices will worsen the recessionary risks, and clearly, inflationary pressures, such pressures escalating even before the Russian invasion of the Ukraine. This is an urgent situation about which I intend to consult later this week with our social partners and key sectoral representatives."
"Covid-19, another prominent risk, has receded in recent weeks but the scientists have certainly not ruled out the possibility of a new variant which could disrupt the delicate recovery of the travel and tourism sectors. When compared to 2019, Belize’s 2021 economic rebound entailed only a 46 percent recovery in overnight tourism arrivals and an 18 percent recovery in cruise arrivals. In other words, for our most vital economic subsector, 2021’s bounce-back represented only a partial recovery."
"In addition to these external variables, there is the urgent need for the Budget to permanently balance the mix between recurrent and capital spending. In this fiscal year, as I highlighted before, 85 cents of every recurrent dollar in revenue will be spent on recurrent expenditure, the largest component of which is Government’s wage and pension obligations."
"With pride and purpose, we have proposed this Fiscal Year 22/23 construct to allow time for the economic recovery to solidify and for wage relief to offset rising inflation."
This posture must evolve as the circumstances evolve.
"For sustainability, I emphasize, revenue buoyancy must continue, and recurrent spending must remain within strict limits, if we are to avoid subsequent adjustments to both tax revenue and recurrent spending."
"Despite these broad cautions, my colleagues and I carry ever more optimism about the future of our young nation. As businesses and schools accelerate their re-opening, with public wages restored and private minimum wages soon to be raised, as Government’s capital investments converge on bridging the welfare and opportunity gaps, with trade and investment policies reaping increased dividends, I eagerly anticipate a multi-year economic expansion, with the thousands of new jobs and hundreds of new enterprises envisioned in our Manifesto."
"That every Belizean should win, and in that glorious sum of collective betterment, for our precious Jewel to shine ever brighter among nations, this shall remain our Administration’s clarion call."
"When I presented my Government’s first Budget last year, I proposed a 5-Point Recovery Plan. Despite the doubt of the then leader of the opposition who said it could not and would not be done, every single one of these points have been effectively addressed during this year:"
* Our Budget pared wages and kept spending within projected parameters;
* A historic debt restructuring eliminated half a billion in public debt;
* Revenues over-performed allowing us the flexibility to table supplementary investments during the financial year;
"* Every major investment-climate indicator has improved: the trade balance narrowed, the current account balance was the smallest in years, bank capital and liquidity are ample, lending rates are down and reserves up, while the official and private sector are more enthused about Belize than in recent memory."
* And Pension Reform is programmed for this year.
"These are the unmistakable measures of progress, the bellwethers of even greater, more inclusive expansion and prosperity."
"If Belize is to grow and develop, all of us must be committed to a strong Belizean economy and society, grounded in credible, practical plans and solutions to the social and economic challenges we face."
With hands and hearts joined together in this great experiment we move forward to build a nation of prosperous citizens.  To live out those fundamental principles enshrined in our Constitution and we remain dedicated to the enhancement of a nation people who not only believe but remain committed to social economic and environmental justice.
"I thank my Parliamentary colleagues, the technicians at the line Ministries and the Ministry of Finance and the Central Bank, and the many professions involved with the preparation of this National Budget for Fiscal Year 2022/23."
I commend this Appropriations Bill for the House’s consideration.
Thank you.


"February 28, 2022"
"Greetings from San Pedro where the Summit is about to start, but I have taken time out to report to you on Cabinet’s first retreat which we held last week."
"My ministers and I held in-depth discussions on the draft budget for fiscal year 2022   2023. We reviewed the IMF’s concluding statement issued at the end of its recent Article IV consultation. While the IMF hailed our impressive economic performance, they cautioned that economically we are not out of the woods yet. Therefore, the Cabinet approved a budget that is prudent and pragmatic. We will emphasize an ambitious social policy agenda which centres on bringing relief to the more vulnerable among us, expanding the NHI program while continuing to rebuild the Belizean economy in partnership with the private sector, the Unions, and non-governmental actors."
"We received a detailed report from the Ministerial Team which met with the joint unions. Significant progress was made in those discussion towards finding a path to restoring benefits for public officers and teachers. After careful deliberation, Cabinet has settled our position on these matters, and we will inform the Unions of the elements of that position which includes much needed pension reform. More importantly, we believe we have found a workable compromise which includes restoring the full 10 percent to public officers and teachers."
"On COVID-19, the Cabinet has decided that it is time to re-balance responsibility in the fight against COVID-19. For some two years, the Government has responded to the pandemic by embarking on a massive public health campaign, securing hundreds of thousands of vaccines, heavily imposing restrictions on personal freedoms and curtailing social and economic activities. The Cabinet has decided that the time has come to restore personal and economic freedoms, while encouraging everyone to act responsibly."
"Effective 1st March the curfew will be lifted. The Minister of Health will provide more details of the process by which we will lift all measures during the month of March as we move towards normalcy on 1st April 2022. We continue to urge Belizeans to get vaccinated and for those who have not yet been boosted, we urge you to do so."
"My Cabinet recognizes that there is a pressing need to address social issues such as the rising cost-of-living increases. While price increases are due largely to external factors, we believe that there are steps that can be taken by government to ease the hardship. We are actively reviewing the basket of goods on which tax relief can be granted, will vigorously increase enforcement of price controls, and adopt measures to curb price gouging."
"Another important issue discussed during the Cabinet Retreat was governance. In this regard there was a strong sense that constitutional reform is needed to strengthen democracy in Belize. The Constitution is designed around a dominant Cabinet, and two main political parties. These structures, which were designed in the previous century, must be reviewed and reformed to meet the needs of a more democratic Belize. To this end, a People’s Constitutional Commission will be appointed to undertake this major task of constitutional reform and is expected to complete its work in 15 months."
"Since taking office we have done what was necessary to rescue Belize from financial disaster, protected Belizeans from the COVID-19 pandemic and, we started to implement our social justice agenda set out in Plan Belize. We will continue the work and press on with delivering on our promise to build a nation where everybody wins."
I thank you.


His Excellency Joseph Biden   President of the United States of America
Heads of State and Government
Distinguished Representatives
Ladies and Gentlemen

We have gathered in the City of Angels.
The American city that most reflects the best and worst of the Americas.
A city that is home to millions of citizens from every country in the western hemisphere.
A melting pot.
A melange.
Un crisol de culturas
"A city in which too many have too much, and too many have too little."
A mirror of the Americas in 2022.
"Los Angeles — a beautiful city endowed with abundant riches, where ambition coupled with hard work makes real the promise of the American dream   that a decent living is possible for the majority."
"My friends we have come to this blessed place to refresh our collective will to do good, and to once again recommit ourselves to building a socially just Americas. From Barrow, Alaska in the north to Tierra del Fuego in the south, the peoples of the Americas await the outcome of this 9th Summit of the Americas. Their needs are many. Their hopes expectant. While our philosophies and approaches are divergent, our vision is the same: to build an Americas that works for all of us."
"But, we are at a tipping point. The Americas and the world face existential threats.  As leaders, we are called to make consequential choices which will irreversibly shape our collective future."
"Excellencies, will we continue to postpone the urgent action needed to reduce emissions, finance adaptation and mitigation and protect the most vulnerable countries and populations from the impact of climate change? We cannot."
Will we implement practical and innovative measures to alleviate the crushing debt crisis? We must.
"Will we ensure that the socioeconomic devastation including the sharp rise in poverty, hunger and education loss caused by the pandemic do not result in a lost decade for the Americas with more irregular migration and insecurity?  We can."
Will we allow ourselves to be divided by failed cold war paradigms or will be meet the profound challenges united and with common purpose? We will.
"These are the questions which underpin the theme of this Ninth Summit of the Americas: “Building a Sustainable, Resilient, and Equitable Future”. How we respond to these questions will design our destiny."
"As we seek solutions we know that money is not the problem. For example, in less than three months two countries in this hemisphere committed over $55 billion to Ukraine. The question is: how much will be pledged to finance the ambitious agendas we agree at this Summit?"
"The future of the Western Hemisphere is a responsibility of all the countries of this hemisphere. Irrespective of our size, or GDP, or our system of governance, we all have a shared interest in a sustainable, resilient and equitable future."
The power of the Summit of the Americas is the space it provides for all the countries of the Americas to dialogue and agree on joint actions. The Summit belongs to all of the Americas.
"It is therefore inexcusable that all countries of the Americas are not here, and the power of the Summit diminished by their absence. It is incomprehensible that we would isolate countries of the Americas which have provided strong leadership and contributed to the hemisphere on the critical issues of our time."
