"My Fellow Belizeans,"
"I thank all those international and bilateral partners, including Taiwan,  that have helped to make it possible; and I say that it is proof positive that Government acted with a comprehensive purpose from the outset to deal with the economic fallout from the crisis."

"This was, I also repeat, matched by our efforts to protect health and safeguard lives. We preemptively discontinued cruise ship arrivals even before closing the PGIA. We directed a national lockdown in the initial stage and we have subsequently isolated, as necessary, cluster-affected communities. We have tested aggressively; and we have legislated comprehensively the required behavioural safety infrastructure and surveillance. At every juncture Government has consulted broadly. We formed the National Oversight Committee right at the start, and have always sought the best available local and international scientific advice to guide our decision making."

"Naturally, the story is not yet ended, the saga not yet over. No one need doubt, though, that we will overcome. We declare this as a certainty, and our assurance is real. This is because it is based not just on stirring rhetoric or a Belizean call to arms. Neither is it based on platitudes. Rather, it is rooted in how far we have already come, and in the recognition of the need for the serious, sustained, programmatic action that will bring the necessary further success. That required action is local and global. It will demand comprehensive debt relief-bilateral, multilateral and commercial; and It will necessitate massive financial support from the IFIs, especially the Bretton Woods twins. Such assistance cannot be tied to normal-times conditionalities that are punitive and will hamper, rather than empower, recovery."

"Fortunately, those that control the levers of international power and the global economy, seem to get it. Already in the citadels of planetary decision making, the calls are growing for a post-pandemic order that will pay special attention to equitability and the needs of countries such as ours."

There is a recognition of worldwide interdependence notwithstanding the asymmetries of size. There is an acceptance of the imperative for differentiated treatment of small states. There is the embedding of the humanizing element needed to curb the inequalities of the old regime.

"In the end, though, Belize’s ultimate triumph will depend most on Belize itself. Our recovery, our tourism and agriculture and manufacturing and services rebound, will oblige us to work harder than ever, make more sacrifices than ever. Most particularly, we will now be mandated to deploy in fullest measure those innate talents, that Belizean capacity, which we proudly possess in demonstrated plenty."

"So, for me, I leave with the certain knowledge that we can do it; that we will prevail because our leaders- political and spiritual and social- are all united in their love for Belize, their will to rescue our country."

"Whoever comes next, then, will surely operate on the basis that it is vision, dedication and faith in Divine Providence that will bring us to safe harbour."

"And so, Hail and farewell. I thank all for the unmatchable privilege of having been allowed to serve this country; and God bless Belize!"

"Que viva nuestra Independencia, y que Dios nos bendiga."
"As the newly assigned Minister of the Blue Economy, I have been following with interest the recent developments regarding the proposed Port of Belize Cruise and Cargo Expansion Project. I have had the opportunity to be updated by our Fisheries Department as well as other concerned environmental non-governmental organizations that are all important players in the development of the new Blue Economy model.  We have been listening to the concerns of those that have been studying and opposing this project ever since it was proposed under the previous government as well as the consultants for the Port of Belize Cruise Project. I have also had the opportunity to dialogue with the Prime Minister and other ministers on this matter."
"After only two weeks of being installed as a government, the overall consensus is that there are so many other pressing issues of national importance that need our urgent attention such as the economic crisis our country is presently in; the increasing number of COVID-19 cases and deaths; and the effects of major flooding in many parts of our country. These are the issues that are priority for us."
"This is a new government, a government that has envisioned and brought to reality a Ministry of Blue Economy which will ensure equilibrium between economic growth while protecting and conserving our oceanic ecosystem.    We must emphatically state that this proposed project has not been endorsed by the Ministry of Blue Economy."
"From our discussions with other key entities including our own Fisheries Department and other environmental groups, we gather that the consultation process has been flawed. There are several entities that have been called out as having endorsed this project while they have publicly stated that they have not. They may have been consulted but that cannot be classified as an endorsement.  With that said, the developers of the Port of Belize Cruise and Cargo Expansion Project are advised to re-think their consultation process and seek ways of addressing major concerns such as ocean dumping in the area proposed which has the potential to jeopardize Belize’s important World Heritage Site, the Barrier Reef, while significantly impacting the tourism sector. These are the important discussions that must be tabled under the watchful eye of the new Blue Economy Ministry."
"Our Ministry has swiftly embarked on the process of formulating a Blue Economy Master Plan. Under this process, proposed projects such as the Port of Belize Cruise will be given greater attention and consideration.  Recognizing that sustainable development is needed to catapult the economic recovery of our country, our mandate calls for greater reliance on the scientific community while assuring economic, social and environmental security for Belize."


Statement on Pro-Good Governance and Anti-Corruption
Hon. John Briceño
Prime Minister


"Today, as across the world countries and governments celebrate Anti-Corruption Day, I take this opportunity to reiterate my unwavering commitment, and that of my government, to fight corruption wherever it is found, in government or out."

"My People’s United Party was elected on November 11th with the most overwhelming mandate in Belize’s political history. It was a victory for the people of Belize, and a message to the outgoing administration that corruption would no longer be tolerated. Indeed, brazen, sickening corruption had become the order of the day, and over the past decade had infiltrated every government Ministry and Department."

"We have made a covenant with the people that no longer will corruption be tolerated as an inherent part of politics. Already we have put structures in place where before there was none. We have commenced investigations in Ministries where public monies and public trust were raped and ravaged. The preliminary findings are shocking, worse than even we could have anticipated, and those will be made available to Belizeans very soon."

"We have directed forensic audits of all statutory boards and utilities, with a view to identifying corruption, restoring oversight and checks and balances, recovering the people’s assets which were stolen and misappropriated and in bringing those guilty to justice. We will ensure that all relevant agencies are empowered to provide necessary oversight and prosecution powers."

"As a responsible, serious government, we will restore good governance, integrity, transparency and accountability to office. We will lead through service to our people and to our nation."




Statement to the Nation
Prime Minister Hon. John Briceño
"Belmopan. April 7, 2021."

"My fellow Belizeans,"

"Beginning in early February, the Government embarked on widespread consultations as an integral part of the preparation of the budget for fiscal year 2021 2022."

This is consistent with my Government’s commitment to consult stakeholders on major issues affecting the welfare of our people and nation.

"These consultations have taken place against the backdrop of the dismal state of the economy and public finances. Many of you will have experienced dramatic slowdown in business activity, job losses, pay cuts, and business closures. The fact is that the economy contracted by 14 percent and 64,000 Belizeans lost their jobs in 2020-21. It is imperative and urgent that we re-energize the economy and create thousands of jobs."

"On the issue of Government finances, the story is just as dismal. In fact, it is worse. Government collected far less in 2020-2021 than was projected."

"Total recurrent revenues and grants are projected to fall by 28 percent; GST collections fell by 32 percent. On the expenditure side, total spending fell by only 15 percent, far below the 28 percent drop in revenue. There is a huge gap between revenues and expenditure. The primary deficit is approximately $300 million dollars. In effect, we do not have enough money to pay salaries, rent and the light bills. Like the economy, the need to return public finances to a sustainable path cannot be overstated."

"On Friday, the House of Representatives will meet, and I will read the Government’s budget for fiscal year 2021-2022. I will detail my Government’s carefully crafted plan to lift the economy from its near moribund state and explain the measures we propose to implement in order to end the contemptible, obscene and reckless UDP spending of the people’s money."

"But before Friday’s speech, we felt that it was important to update you on where we are with the Unions."

"I would describe the consultations as full, frank, and courteous. I thank all those who have participated in the consultations. In light of the dire financial position of the Government, we took a close look at every aspect of Government’s revenue and expenditure with a view to righting the ship of state. To do this, we must increase revenue and cut expenditures."

"We will propose a 31 percent cut in expenditure on goods and services by the Government compared to the last Budget. This is expected to reduce expenditure by $77 million. We will also propose a 10 percent cut in the expenditure on Subsidies and Transfers compared to the last Budget. This will reduce expenditure by $19 million. Additionally, we expect to negotiate substantial savings upwards of $50 million dollars on the Superbond to reduce Government’s debt-service outlay."

"In the context of these reductions, it is wrong to regard our consultations with the Unions as only about a wage adjustment. The consultations covered a lot more. It is important to explain why the discussions were wide-ranging, and to explain the context in which they were held."

Let me frame the challenge.

"Government is the biggest employer in Belize. There are 15,000 public officers including 4,000 plus employed in the education system and 4,900 in the security and border services."

"In 2008 when the PUP left office, the wages and pensions bill was $262 million dollars. In 12 years under the UDP the wages and pensions bill skyrocketed to $677 million dollars, an increase of 177 percent or an increase of $415 million dollars."

"I repeat, the Government has been borrowing about a million dollars per day to pay salaries, pensions, and expenses for goods and services. Last month, we were again forced to borrow $30 million dollars to meet expenses."

"Earlier today, the Financial Secretary informed me that the Central Bank confirmed that after mid-April salaries are paid, the Government will have insufficient monies and will be forced to borrow again to meet its obligations at the end of April."

The position is critical; public finances are on life support!

"The raw and unpolished truth is that we inherited a broke and plundered treasury from the UDP. After careful analysis and consultation, we remain convinced that a salary adjustment of $60 million dollars is absolutely necessary. Additionally, we propose to continue the increment freeze, which will account for another $20 million dollars annually."

"Unfortunately, the Unions have not, so far, agreed with us that these adjustments are needed. It is important for all of us, union members included, to know that the Government has provided the Unions with all information that they have requested. If they complained that information has been kept from them it is not so. Indeed, our consultations have been open and transparent."

"Additionally, we put forward numerous proposals in our attempt to win support of the Unions. For example:"

1. We proposed that public sector workers and teachers would work (4) hours less per week; they in return asked for 5 hours and we agreed.
2. We secured the agreement of the Central Bank to extend leniency on defaulting loans until the end of 2021;
3. Both the DFC and the National Bank have agreed to make available five million dollars in loans to public officers and teachers;
4. We have agreed to waive stamp duty on mortgage transfers by teachers and public officers;
5. We offered to protect the lowest income earners from core wage adjustment;
"6. We proposed reducing further the salaries and benefits for Ministers and Ministers of State, Representatives and CEOs;"
7. We agreed to accelerate the Reform Agenda including the Whistleblowers’ and Unjust Enrichment Laws; and
8. We supported the Joint GOB/Social Partner Monitoring Committee to assess the performance of the Budget every 6 months.

"In short, Government made every reasonable concession to garner support from the Unions."

"My fellow Belizeans, my Government was elected to office with a massive mandate to bring change. We were elected to fix the economic and social problems created by the UDP administration. The people of Belize have voted overwhelmingly against business as usual. Therefore, we intend to deliver on that mandate."

"After assuming office, I reported on more than one occasion that the UDP had bankrupted the country and that we would have to experience a period of austerity, before we return to economic dynamism and growth."
"Some people said, because of the austerity measures we had implemented, we would lose the municipal elections."

They were wrong.

The PUP received a historic mandate as the Belizean people in every district reaffirmed their faith and confidence in our party and in Plan Belize.

"Today I was informed that the Joint Unions are preparing for industrial action. That is their right.  As it is our responsibility to ensure that we continue to provide the needed services to our people, and we shall do so."

"To defeat COVID-19, fight poverty, grow the economy, create jobs, provide low-cost housing, and provide affordable education, we must first accept the reality of our financial predicament, and implement a plan that will deliver us from this difficult place where we are. I will explain our plan on Friday in the House of Representatives."

"My Government remains open to constructive suggestions that are consistent with the urgent need to reduce expenditure and to increase revenue. We cannot continue with the reckless borrowing for it will destroy us all. If we unite and support a plan to restore our Belizean jewel to economic prosperity, we will all win."

Como un gobierno … con un mandato sin precedentes…y elegidos para gobernar…tenemos la responsabilidad de gobernar para todos los beliceños. Tenemos la obligación de velar por el bienestar de nuestro pueblo en general.
Y es por esto… que hoy después de hacer todo lo posible para que los sindicatos entiendan y trabajen con nosotros para reponer la economía del país…hemos tomado la decisión de proseguir con el presupuesto que se les pre/sen/to.

Todo esto después que hemos hecho todo para satisfacerlos y justificar las decisiones.

Ha llegado la hora de seguir adelante y enfocarnos en sacar a nuestra gente de esta obscuridad.
"Nuestro plan es bueno…no fácil…pero equilibrado… y esta diseñado para forjar una sociedad trabajadora, productiva y viviendo una vida saludable y digna."
Pero para que logremos este objetivo necesitamos a todo beliceño.

¡De esto debemos salir juntos!

Thank you and may God bless Belize.


BUDGET SPEECH FOR FISCAL YEAR 2021/2022
Hon. John Briceno
"Prime Minister and Minister of Finance, Economic Development and Investment"
"Belmopan, Belize"
"Friday, April 9, 2021"
Introduction
"Madam Speaker,"
"I rise to present Government’s Estimates of Revenues and Expenditure for the Fiscal Year 2021/2022, and to report on the performance of the National Budget for the current Fiscal Year 2020/2021."
"This is the first budget for the 5-year cycle 2021-2025, the first also for my Administration — coming to office, as we did, on the thrust of a ‘wave election’ on 11th November 2020."
"That extraordinary mandate was ratified by an almost unmatchable margin less than four months later, in the municipal elections of March 3 of this year. With just 31 additional votes in the mayoral race and 23 votes in the elections for counsellor in the twin towns of San Ignacio/Santa Elena, our Party would have secured 67 of the 67 seats available instead of 65."
"Along with these historic endorsements have come immense responsibilities, which obligate us to rise to the demands of the Constitution, our Manifesto, and the national interest. And it is to that national interest that this revenue-collection and spending process -  the Budget process — must do justice."
That this Budget Presentation comes at a juncture of unparalleled national crisis is indisputable.
"Belize is facing her most severe economic, fiscal and debt crisis."
"And though the health crisis caused by Covid-19 is currently in remission, with the virus’s spread largely controlled, the recent ‘resurgence’ that is being seen in Europe, and closer to home, in Antigua and Barbuda, and elsewhere, should caution us that our substantial progress can quickly be reversed. To state the obvious, Madam Speaker, the virus is ever present, the risk to Belize and Belizeans remains real. We must remain vigilant."
"How we navigate through this extraordinary crisis; the extent to which discipline, sacrifice and solidarity prevail; the efficacy of our home-crafted Medium Term Economic & Fiscal Recovery Plan, will, in sum, determine the well-being of our people, the resiliency of the public finances and the durability of the value of the Belizean dollar."
"It is worth noting that the amount required to meet the demands of our constituencies typically outpaces budget funding even in normal times. The mismanagement and mess we inherited, however, has widened the gap between these two amounts to an almost unmanageable degree."
"At the outset, allow me to recognize the many contributors to this delicate, consensus-building budget process, starting, naturally, with my Cabinet and Parliamentary colleagues who have confronted this unprecedented national emergency with poise and with patience."
"And I thank also the social partners, with whom there have been genuine consultations. I acknowledge the Belize Chamber of Commerce and Industry, the Belize Business Bureau, the Council of Churches and the NGO community. I applaud the Joint Unions for their extensive contributions as well as those many public officers whose execution of their duties had an impact in ways small and large upon the participatory exercise of composing this budget."
"When all is said and done, the National Budget is really a Budget about all the people — working people and businesspeople -  because from its birth to its burial, the National Budget touches all Belizeans in some way or the other.  And this budget in its plain speak, realistic goals and honesty will usher in a new time in our national development and with an optimism that the shared sacrifices we make today, will result in all of us being able to triumph tomorrow."

REGIONAL AND DOMESTIC CONTEXT
"Except for the opportunity to vote out the UDP Government, 2020 is a year most Belizeans would rather forget. What was designated in the Chinese calendar as the Year of the Rat turned out to be the Year of the Black Swan, with the onset of an unforeseeable, once-in-a-century global health disaster."
"From this rolling public-health-cum-economic catastrophe, there would be no safe harbor."
"* According to the IMF, the global economy shrank by 3.5 percent."
* Central America’s fell by 6 percent.
* The tourism-dependent Caribbean economies sank by 10 percent.
"The output generated by Belize’s economy, 40 percent of which was previously lifted by tourism’s propulsion, nosedived by 14 percent, a steeper fall than all except for 5 countries, 2 of which are fellow Caribbean, tourism-dependent states."
"With an economy already firmly in recession, having contracted all of 2019, the pandemic quickly turned the UDP recession into a full-blown depression. In addition to the thousands unable to find work before Covid-19, 64,000 more Belizeans lost jobs, thousands of businesses pivoted to emergency mode after a mandatory lockdown, and the Government, hamstrung from years of excessive borrowing, mismanagement and distracted by a pre-election feeding frenzy, could do very little, except, of course, to borrow, borrow and borrow more. By none other than Mr. Barrow himself."
"I digress, for just a moment, to lament the loss of life caused by the Covid-19 virus — 318 Belizeans to date, a loss far more regrettable than the loss of livelihoods. We continue to mourn these fallen Belizeans who succumbed to Covid-19 and offer prayers for the comfort of their families and loved ones. On this side of the House, we grieve for our colleague and friend from Corozal Bay, the late David Vega, who left us far too early."
"To the new Representative from Corozal Bay, the Hon. Elvia Vega-Samos, Dido Vega’s sister, we offer first our solidarity and of course our congratulations and full support."
"Madam Speaker it is undeniable that the UDP Administration turned over to my Government an economy that was far worse than a mess, they turned over an economy that was in veritable tatters: a busted budget for this fiscal year that has required average borrowing of more than $1 million per day, a soaring level of unemployment that is afflicting 29 percent of the workforce and a total public debt that’s the sixth highest in the world."
NOT even those on this side of the House could have imagined these possibilities.
"The sixth most indebted nation, the fifth most severe depression of 2020, our status as one of only 13 countries on the planet that do not even appear in Transparency International’s Corruption Index, hence leaving us without a ranking   that is the legacy of the UDP."
"This is the extent of the national decline which my Administration begins to reverse with this, our first National Budget proposal."

DOMESTIC ECONOMY AND FINANCIAL SECTOR DEVELOPMENTS
"As a prelude to revealing Government’s overall Medium Term Recovery Plan, it is important to share some snapshots of the domestic economy as well as the financial sector. While the overall economic output fell by 14 percent, this drop was not uniform. Clearly, the service sector was hardest hit, with hotels and restaurants crashing by 60 percent and the yields in the overall tertiary sector dipping by 17 percent."
"Consequent to that fall, output in the secondary sector, where manufacturing and construction are recorded, fell, but not nearly as precipitously, with a decline of 1.8 percent. Sales of such products as flour and beer, which are tied to tourism, faltered, but hydroelectricity rebounded handsomely, rising by 15 percent, year on year for 2020."
"The primary sector’s outturn decreased by 2.4 percent, impacted largely by a 27 percent fall in fishing activities. Positively, agricultural output posted a positive performance, if just slightly, with a 0.5 percent increase, due largely to a rise in the revenue we earned from the sales of our southern staples, citrus and banana."
"Some crisis markers, at least temporarily, moved in unexpected directions — for example, the balance of trade, balance of payments and reserve position of the Central Bank. Imports fell for the year 24.5 percent, outpacing the fall in exports, and with remittances rising and profit repatriation falling, the balance of payment deficit narrowed from 9.3 percent of GDP to 6.9 percent. Government access to and rapid drawdown of borrowed funds expanded the import cover of the reserve position modestly, from 4.1 months in 2019 to 5.2 months in 2020."
"Relatively speaking, the domestic financial system maintained its solid standing. Excess statutory liquidity totaled $420.3 million at the end of last year, non-performing loans totaled 5.8 percent, and the weighted average lending rate stabilized at 8.5 percent."
"In its recent Article IV Statement, the IMF concluded that “the banking system entered the pandemic with abundant liquidity and strong capital buffers,” a rare positive assessment in an otherwise dire report by the Fund."
