"My Fellow Belizeans,"
"The sounds of the Corona alarm are everywhere   on television, from social media, and in our conversations with friends and family."
"I know this is an excruciatingly stressful time for all of us. It is even more so for our senior citizens, those who have lost their jobs and our frontline health care workers."
"We rightly worry about our individual and collective situations. After all, as a nation we are facing the greatest crisis of modern times."
"In these extreme circumstances, at this extraordinary moment, I have felt it my duty to come to you directly. I am most conscious of the wonderful help the Nation has received from so many people. First among them is the medical team led by the Ministry of Health and the Karl Heusner Memorial Hospital. The Doctors Manzanero, CEO Gough, others in the leadership brain trust, the Hon Minister of Health and most particularly the frontline workers at the KHMH and the other public hospitals: they all deserve our highest praise and our greatest thanks."
"As well we are indebted to the Leader of the Opposition and his colleagues, all the social partners represented on the National Oversight Committee and the National COVID-19 Task Force. These are bodies on which all GOB CEOs, the Leader of Opposition’s representatives and very many expert Belizeans are serving."
"On your behalf, I offer them our profound gratitude. And I wish to declare how much I personally have benefited from this national partnership and its collective decision-making process."
"In the end, though, as Prime Minister I am the one who has to accept the ultimate responsibility for custody of the nation’s wellbeing. Especially in this time of an existential crisis of seemingly Old Testament proportions, I must personally come before you. Hence the reason for this address."
"My primary message is to assure that you are not alone, neither in your anxiety about the present challenges nor your preoccupation about the future."
"I thus reiterate to every Belizean that my administration, together with the national committees, will spare no effort, will action every partnership, will lose no opportunity to cushion the economic impacts and minimize the medical repercussions of this pandemic."
"You know that neither the depth nor the duration of this battle is yet clear. In this connection, Belize and all countries — from the richest to the poorest — are in the same boat. We face a lethal, deadly enemy that refuses to stay still long enough for us to get a bead on it."
What is nevertheless also clear is that our country is properly positioning itself for this battle. We do so both on the economic and the medical fronts.
"First and most important, we can feed ourselves. And there are two things that are important in this connection. The global supply chain that facilitates imports of essential inputs for our country is not being broken. Even more important, though, is the fact of Belize’s self-sufficiency in all basic commodities. With our local production of grains, meats, vegetables and poultry products we are able to dig in for the long haul. That is what sets us apart."
"Second, Government is determined to deploy a diverse range of fiscal and monetary measures to fortify our economic structures and bring us through. Our measures include aid to the newly unemployed and the longer unemployed; commercial banking and credit union support to business and the self-employed; and one form or another of customer relief from our utility providers. Broadly speaking, all options are on the table and every backing we can at all come up with will be used to stabilize the economy and underpin the welfare of the people."
"Third, our team of public healthcare professionals — reinforced by a first-rate medical brigade from our Cuban allies and buttressed by a massive investment in emergency equipment and supplies — will relentlessly identify, isolate and treat cases of COVID-19."
"I repeat that, as hard as the circumstances are, there is no need to panic. And even if we have to take the ultimate step of a national shutdown, there will be no interruption of essential services. Access to food, pharmaceutical and other necessary supplies will be guaranteed."
"In short, Government and its partners will move heaven and earth to protect our Belizean people."
"Of course, we need your help; we need the cooperation and understanding of each and every Belizean. This crisis, like no other, demands a unity of effort, a spirit of collaboration, an overflow of fellow feeling and a pouring forth of all the reserves of national humanitarianism and patriotic solidarity."
Therefore:
Practice good personal hygiene;
Distance yourself socially for this crisis period;
Isolate yourself and report Corona symptoms to the health authorities;
"Adhere, without exception, to emergency and health guidelines; and, above all, be prepared to lend a helping hand to your neighbor, your friend, your fellow Belizean."
"I repeat, there is no need for panic. We don’t have to crowd the supermarkets and grocery stores because there is more than a sufficiency of necessary supplies. This will continue for as long as the pandemic lasts. Most important, there is great harm in spreading false rumors and certainly no benefit in stigmatizing persons that may become unwell."
"I ask you always to remember our advantages. Our small, dispersed population is spread over two cities, seven towns and over 200 villages. We are, therefore, blessed by a good degree of natural physical distancing. And our interconnectivity will allow for effective tracking and treatment in the eventuality of COVID clusters emerging."
"My message to you is, therefore, one of hope. But that is not to sell short the seriousness of the crisis. It will challenge our resilience. It will test our endurance."
"I have every confidence and not a single doubt, though, that this too shall pass; that we will once more emerge into our famed, golden, life-affirming Belizean sunlight; that we shall overcome; and that at the end of our trials we shall be once more grasping with both hands the overflowing cup that a beneficent Providence has always reserved for us. We are fortune’s child; and we will rebound to seize that special destiny marked by fate for this special land."
"Belize now and forever, God bless Belize."
Thank you.


"My Fellow Belizeans,"
"Last week, the Government announced additional measures to ramp up our fight against COVID-19. At Wednesday’s press conference I made clear that we were not then announcing a national shutdown. The circumstances at that time, in our view, did not yet warrant it. But I also made clear that we should prepare ourselves for just such an eventuality: that there were possible, indeed likely, developments that would act as triggers for a shutdown."
"As we all now know, yesterday, a Belizean that had returned from New York on March 20th, tested positive for the novel Coronavirus. That person claims to have been in self-isolation since his arrival back in Belize and was able to show health workers the contained and separate lower flat of the building in which his claimed isolation took place.  The individual, though testing positive, is exhibiting only mild symptoms and is not currently in need of hospitalization. Nevertheless, he is living in Belize City — home to the largest population concentration in our country. For the National Oversight Committee, and for the Cabinet of Belize, this is very significant. Clearly the crowds in the old capital make us more susceptible to widespread transmission. Thus, a comprehensive tracing of the afflicted individual’s possible contacts and a wider mapping exercise are both being done by the Ministry of Health team."
"In this connection, both the evidence from other countries and the advice from our own experts agree on one thing: the best way to at least slow, and hopefully stop, the spread of the virus, is by strictly enforcing the physical distancing, self-isolation, quarantining and other such rules. Even though we have already imposed a state of emergency for Ambergris Caye and passed two statutory instruments imposing penalties — including jail time for those that do not comply with the law — too many Belizeans are not taking the measures seriously enough. In all the circumstances, we consider it our duty now to do even more to prevent any chance of Belize City becoming an epicenter of COVID-19, indeed, to try to protect our entire country from the novel Coronavirus."
"Accordingly, I will be advising His Excellency the Governor General to declare a nationwide state of emergency for the country of Belize. This will go into effect at midnight on Wednesday, April 1st, and will include a curfew from 8:00 p.m. to 5:00 a.m. every day. The state of emergency is to last for 30 days in the first instance. For its duration people will be advised to shelter in place even during daylight hours and only to come out as absolutely necessary for purposes of procuring supplies, and doing such business and activities as are exigently required."
"Our National Task Force and our Caucus of CEOs have been planning for this eventuality for some time now. Nevertheless, and as we had promised, we are giving a couple of days’ notice for two reasons. Our people must have a chance to prepare for the new normal; and our officials must have a little more time to ensure that all systems are in place to guarantee the absolute availability of foodstuff and other critical supplies. The list of essential services and essential service workers is being finalized and their operational logistics are being fine-tuned."
"Tomorrow, we will be holding a press conference for only the media at the Laing Building at 10:00 a.m. There, we will go into all the details — medical, logistical and organizational — about the state of the emergency. We will, of course, answer all questions from the media."
I close by expanding on two things.
"First, I want to repeat what I said in last week’s address to the nation. This country is self-sufficient in basic staples and we can feed ourselves for the long haul. The continuity of essential services and the more than ample availability of supplies are both guaranteed and there is no need to panic."
"Supermarkets, grocery stores, banks and credit unions will all remain open and every arrangement is being made for local producers to proceed uninterrupted with the provision of meat, chicken, eggs, rice, beans, grains, vegetables and so on. Cargo will also continue to come into our country and essential imports are also secure."
"The second point I must make is this. Our local health team and the Ministry of Health are so plentifully resourced that we could theoretically reach the point of equipment oversupply. I hasten to add, though, that there can never really be too much   I’m just trying to underline the fact that we are completely prepared for the battle on the health front."
"So, the Ministry of Health costed the requirements for a six-month battle against COVID 19 at around 12 to 15 million dollars, Belize dollars. We already have in hand close to 20 million dollars and 13 million more is arriving from the IDB in a matter of weeks. Therein, though, lies the beginnings of a possible problem. All the International Financial Institutions, perhaps understandably, are laser focused on the health front of this fight against COVID-19. As critical as that is, though, what I keep telling our international partner is that it is equally important for us to feed and clothe our people; for us to take care of those now out of work and livelihood, unable to take care of themselves and their families."
"Government, as you know, is already borrowing 75 million from the Central Bank.  But this is a drop in the bucket. It is my solemn promise to you, however, that we will get more. I am in no doubt that we will end up at least doubling that 75 million dollars. Thus, there will be add-ons to the disbursement of money to our unemployed, which disbursements start this week and will also initially utilize the contributions made by BEL, BWSL and SSB. The additional funding that we will procure will augment the national ongoing BOOST Initiative that also already puts cash in the hands of our people; and we will also expand countrywide, including to the rural areas, the Ministry of Human Development’s all-important food assistance program."
"Belizeans: I say again that you are not alone. Together we will overcome.  And I swear by that Almighty God, whom I ask now to bless us all, that Government, our National Partnership, and I personally, will do everything to bring Belize as whole as possible out of this national and international nightmare."
I thank you.


"My Fellow Belizeans,"
"Earlier today, the Ministry of Health’s leadership team publicly announced the worrying news of test results having this morning   confirmed Belize’s fourth case of COVID-19."
"The infected person is from the Cayo District, but up until about 11 days ago, had been traveling to and from Belize City where he worked. He is in isolation at the Western Regional Hospital and the DHS and his team have already commenced their mapping and tracing exercise. Indeed, swabbing of contacts as a prelude to testing has already started; and the exercise includes coverage of the medical professionals involved in the treatment of the patient."
"In view of all this, my message today is for a two-fold purpose."
"It is clear now that the State of Emergency declaration and the shuttering of the country came not a moment too soon. Still, there are people insisting that we are overreacting in promoting some of the draconian measures contained in the revised statutory instrument signed last night by His Excellency the Governor General. I hope that this fourth case will help to persuade them of the absolute gravity of the situation."
"Accordingly, I also appeal to everyone not to try to beat the system. Stop trying — and here I pitch my petition to business owners and individuals — stop trying to find workarounds or opt-outs of the restrictions that force you to close and that limit your activities. I repeat that your movements must only be purpose-driven, confined to the reasons clearly listed in the Emergency Regulations."
"Travel across district lines is curtailed, and Easter is cancelled except, of course, as an opportunity for prayer, reflection, and virtual attendance at the religious services that our churches will live stream."
"You all know that our first two cases, one of which led to the infection of a third person, were imported. This fourth one seemingly was not. It, therefore, makes crystal clear the urgency of the heightened vigilance and protective measures that the State of Emergency is designed to achieve. And there is yet more to be done. In the result, I will now, after a word of explanation, announce an additional ramp-up to our Emergency Regulations."
"Some days ago, we notified of our decision to place all Belizeans entering or re-entering Belize, under a mandatory 14-day quarantine. Since that time around 19 Belizeans are now confined in Corozal Town at two facilities. Yet, they keep on coming. This is a stark reminder that our first two cases were brought in from L.A. and New York. The situation of Belizeans that have been in the U.S. and Mexico simply returning to the country willy nilly, cannot be allowed to continue. It leaves the door wide open to importation of the virus and this can upend all our war efforts against COVID-19."
"As a consequence, and after obtaining the unanimous support of the National Oversight Committee, the Government of Belize has decided that our borders are now to be closed even to Belizeans seeking to enter the country. Except in the case of those that are returning from travel for urgent medical attention or some other emergency purpose, no Belizean currently abroad can return to Belize. This prohibition will, in the first instance, last for the duration of the State of Emergency; and it will begin at 12:01 a.m. on Sunday, April 5th."
"It is, I readily admit, an extreme move. There is, however, no doubt that it has become necessary as we do everything to head off the swamping of our health system and the serious loss of life that the proliferation of the virus would entail. I, therefore, ask all Belizeans, and particularly those in the diaspora, for their understanding. This is the fight of our lives and I deliberately use the metaphor when I say that Belize must absolutely be placed on a war footing."
"Our new decision is, as we have checked and double-checked, entirely legal and grounded in the powers contained in the Constitution of the country and under the Governor General’s Emergency Proclamation. We shall therefore proceed and for the next 30 days our position is irreversible. That, however, is not all."
"The circumstances of the Cayo case make clear that the danger of extensive human-to-human transmission is now upon us. I, therefore, reserve the right to come back to you next week to announce even more stringent shutdown directives."
"Some businesses that escaped first round closure might find themselves included in a second round. Naturally, this would only happen after the National Oversight Committee meeting on Monday and consultation with Cabinet."
"I close by sharing some good news on the economic front. The application forms for those that have lost their jobs and are to be provided GOB relief are now available. In fact, there has already been a first rush of applications. The verification process is underway, and people should be seeing their money in the banks within two or so business days."
"Finally, OFID has confirmed its agreement to the reprogramming of 10 million Belize dollars from the infrastructure component of the Southside Poverty Alleviation Project. That money will now be used to augment our cash to the people program. Additionally, OFID is fast tracking approval for a new Belize loan in the amount of 20 million dollars. When all of this is placed in the pool of funds to come from the World Bank and the IDB, we are well on our way in the effort to leave no one behind in the exercise to cover comprehensively our unemployed and those struggling to feed themselves and their families."
"As always, then, together we do our best and together we shall prevail."
"Venceremos,"
And God bless Belize.


"My Fellow Belizeans,"
"It is my sad duty to announce the death this afternoon of the fourth patient to be diagnosed in Belize with COVID-19. On behalf of the entire nation, I offer deepest condolences to the wife and family of Hubert Pipersburgh. He was a well-known, indeed renowned, Belizean who served his country both at home and in the diaspora."
"Mr. Pipersburgh was diagnosed in San Ignacio early on Friday last, and was transferred to the KHMH that same evening. He was then intubated and appeared stable until today, when he deteriorated sharply. He died despite what I am assured were Herculean efforts on the part of the medical staff to save him."
"Mr. Pipersburgh’s death is an occasion for mourning. It is also a reminder, coming to us in the worst possible way, of the need for all Belizeans to treat this terrible virus with the grave seriousness it deserves. No one need doubt that such a reminder is necessary. Every day since the declaration of the state of emergency, the police have had to arrest scores of persons for breaking curfew and breaching the stay-at-home and social distancing regulations. The social media pictures of people piled almost on top of one another at the Michael Finnegan market in Belize City yesterday, are further and shocking proof of our heedlessness."
"I can only hope and plea that the tragic death of Mr. Pipersburgh, and the announcement early this morning of COVID-19’s fifth confirmed case in Belize, will cause the fundamental change in behavior that is a must if we are to defeat the pandemic."
"Of course, the Ministry of Health continues to work tirelessly to combat the spread of the virus. Very quickly after his diagnosis, close contacts of Mr. Pipersburgh, both in San Ignacio and Belize City where he worked, were swabbed and tested. That number amounted to 49. Additionally, 41 health care providers from the three medical facilities he visited were also tested. Thankfully, all tests have come back negative."
"The Ministry has also placed patient #5, a Belizean that a couple of days ago came back from the U.S. via Mexico, in strict quarantine. This was done in Corozal immediately upon his entry into the country, thus minimizing the possibility of any transmission from that patient."
"The point of rehearsing all this Ministry of Health activity is to reassure Belizeans. Tireless work is being done on the medical front, and there is no need to panic."
"The front line of the Ministry of Health has been strengthened by the recently arrived Cuban medical brigade. And I have directed the drafting of a number of non-government medical personnel, both doctors and nurses, to join an advisory, planning and coping unit to assist the Director of Health Services and his team."
"The National Oversight Committee meets virtually tomorrow and the same modality will now serve for Cabinet meetings. In that context, I expect an urgent analysis of the current medical situation and consideration of any further measures that may be necessary."
"I will report accordingly, and meantime, I thank you and ask God’s blessing on Belize."


"My Fellow Belizeans,"
"I need periodically to bring you up to date on our war against COVID-19, and it is for that purpose that I address you now. There are, of course, two basic fronts to our campaign: the medical and the socioeconomic."
"Regarding the medical, I am certain that we are making every effort to do the right thing. The nationwide lockdown is one sure way of helping to contain the spread of the virus. Accordingly, that lockdown will be made to run at least its 14-day course."
"The core medical team, tirelessly led by Dr. Marvin Manzanero, is receiving more expert support than ever. Several additional medical personnel have joined the National Task Force and have been given various critical assignments. Gaps and omissions are being addressed in as inclusive a manner as possible, in which connection the preliminary understanding reached with the KHMHA Union is key."
"Ample testing has always been our necessary objective, and a decisive increase is now in full flood. This has been made possible by the acquisition of a better than sufficient supply of test kits, accompanied as well by the procurement of more PPEs. We are therefore well-armed to pursue and try to control the Belize City and San Ignacio outbreaks, the COVID-19 clusters."
"I say again that we are as fortified as we can be in combating this most deadly and elusive of enemies. And I salute all those, especially the front line health and essential workers, that have been in the vanguard of our press against this demon foe."
"I also remind Belizeans, though, that you are the ground troops in this battle. So, hold the safety standard high. Wear your mask; practice good hygiene; adhere to social distancing; lend a hand to your neighbor; and please refrain from spreading rumors."
I turn now to the socioeconomic aspect of what is proving to be our long nightfall.
Our principal efforts here are twofold: to disburse all needed unemployment relief funds and to roll out an emergency countrywide food assistance program.
"We are in the middle of an economic shock the likes of which the modern world, let alone our beloved Belize, has never seen. Business activity has come almost to a halt, people have lost their jobs and livelihood, and revenue sources have dried up. The tax base has utterly eroded and we are terribly short of money. We are without coin of the realm and it is not possible to collect anything but a trickle. Still, Government must operate and the country must be kept going. We have to find salaries, especially for our doctors and nurses, our security forces, immigration and customs officers and all the public servants that keep the Administration operational. We must keep the lights on and the water flowing. We must pay for the PPEs and the testing kits and the Cuban brigade that has left their homeland to assist us."
"Above all, we must help our people, we must feed our people."
"It is an unprecedented challenge, it seems an impossible task. But it is one we go after with hands and heart, and we will prove equal to the job. Borrowing from our Central Bank, working with the international donor community, employing every resource we can, we WILL deliver to our citizens in need."
"As of today, then, 23,264 persons have already been approved for unemployment relief, and their payments sent to their banks. Ultimately, this particular safety net will cover upwards of 50 thousand persons."
"Likewise, 4,000 households, for a total of 17,000 beneficiaries, have received food baskets. This first tranche of that particular program is costing Government 12 million dollars."
"Now this unparalleled outreach in this unparalleled time has not been perfect. We wish that the money and the food could be more. We wish that the distribution process could be faster. But the shock to our lives, our economy, our systems, is like nothing any of us has ever witnessed. Everything has been shattered, our capacity is under the most unimaginable strain. And as has been demonstrated in even the great United States of America, it will take more than a day, a week, a month to put Humpty Dumpty together again."
